{"type":"config","name":"优化 ASR 性能与稳定性","metricName":"asr_response_time","metricUnit":"ms","bestDirection":"lower"}
{"run":1,"commit":"5b5d752","metric":0,"metrics":{},"status":"crash","description":"Added ASR ready-latency benchmark script; run timed out due lingering websocket/error path even though median ready latency parsed at 520ms.","timestamp":1775295314183,"segment":0,"confidence":null,"iterationTokens":1225,"asi":{"hypothesis":"Measure ASR session startup latency to validate stability improvements in live mode.","rollback_reason":"Benchmark process did not terminate cleanly (timeout), so result is unreliable for keep/discard.","next_action_hint":"Fix benchmark teardown by waiting for close or force-closing session; then rerun for stable metric.","observed_metric_ms":520}}
{"type":"config","name":"Live模式 ASR/TTS 稳定性与响应优化","metricName":"asr_response_time","metricUnit":"ms","bestDirection":"lower"}
{"run":2,"commit":"83ce096","metric":413,"metrics":{},"status":"keep","description":"Baseline: measured median ASR session ready latency (3 runs) with current live pipeline.","timestamp":1775295371818,"segment":1,"confidence":null,"iterationTokens":135,"asi":{"hypothesis":"Current live ASR startup latency is the baseline before applying stability/retry optimizations.","baseline_runs":"360,413,502","notes":"No audio sent in this benchmark; measures session-ready responsiveness only."}}
{"run":3,"commit":"83ce096","metric":482,"metrics":{},"status":"discard","description":"Added ASR request timeout/retry and TTS watchdog recovery in LiveRoomWorkspace; benchmarked ASR ready latency worsened (median 482ms vs 413ms baseline).","timestamp":1775295441096,"segment":1,"confidence":null,"iterationTokens":2834,"asi":{"hypothesis":"Retry/timeout handling and TTS watchdog should improve live stability without regressing ASR startup latency.","rollback_reason":"Primary metric regressed relative to baseline on current benchmark workload.","next_action_hint":"Try backend relay/session-level optimizations (faster ready path) and benchmark with real speech payload + end-to-end turn latency.","runs":"422,482,522","learning":"Frontend resilience changes likely do not improve server-side ASR ready latency; need stability metric in addition to startup latency."}}
{"run":4,"commit":"30b3ac8","metric":290,"metrics":{},"status":"keep","description":"Reduced ASR relay init fallback from fixed 250ms to configurable default 120ms and centralized ready-path logic; improved median session-ready latency.","timestamp":1775295507396,"segment":1,"confidence":1.7826086956521738,"iterationTokens":3346,"asi":{"hypothesis":"Lowering init fallback wait should reduce live ASR startup latency while preserving ack-based readiness.","changes":"Added markSessionReady helper and VOLCENGINE_ASR_INIT_FALLBACK_MS default=120.","benchmark_runs":"192,290,386","caveat":"Benchmark measures session-ready latency (no speech payload), not full transcription quality."}}
{"run":5,"commit":"1b86aed","metric":287,"metrics":{},"status":"keep","description":"Improved relay finish behavior: close session directly when no audio was sent to avoid backend 1012 errors and reduce no-speech instability.","timestamp":1775295560221,"segment":1,"confidence":2,"iterationTokens":2021,"asi":{"hypothesis":"Avoiding empty final frame for no-audio sessions improves stability and slightly reduces ready-to-close latency.","changes":"Added sentAudio tracking and no-audio close path in finishRealtimeAsrSession.","benchmark_runs":"171,287,308","stability_gain":"Removed recurring 'No valid data found in input audio' error path in no-speech turns."}}
{"run":6,"commit":"df6f704","metric":223,"metrics":{},"status":"keep","description":"Added guarded adaptive init fallback (default 90ms + delayed guard when pending audio exists) to improve ASR ready responsiveness while reducing early-flush risk under real speech.","timestamp":1775295754995,"segment":1,"confidence":2.8358208955223883,"iterationTokens":407,"asi":{"hypothesis":"Lower fallback should reduce startup latency; guard delay when pending audio protects stability from premature ready.","changes":"VOLCENGINE_ASR_INIT_FALLBACK_MS default 90, VOLCENGINE_ASR_INIT_GUARDED_DELAY_MS default 80, two-stage timer in open handler.","benchmark_runs":"200,223,378","stability_expectation":"If user audio arrives before ACK, ready emission can be delayed by guarded window to avoid too-early flush."}}
{"run":7,"commit":"34cc6e3","metric":152,"metrics":{},"status":"keep","description":"Cached ASR env/config values in relay hot path to reduce per-session setup overhead and avoid repeated env parsing.","timestamp":1775295849893,"segment":1,"confidence":2.7473684210526317,"iterationTokens":2140,"asi":{"hypothesis":"Eliminating repeated requiredEnv/optionalEnv lookups in session creation and init payload can reduce startup overhead.","changes":"Added cached getAsrEnvConfig() and reused appId/accessToken/cluster/resourceId across createRealtimeAsrSession/buildInitPayload.","benchmark_runs":"145,152,327","risk_check":"Configuration still read from env once per process; no protocol behavior changes."}}
{"type":"config","name":"Live ASR pending-audio startup stability","metricName":"asr_response_time","metricUnit":"ms","bestDirection":"lower"}
{"run":8,"commit":"e35534e","metric":328,"metrics":{},"status":"keep","description":"New baseline for anti-overfitting workload: ASR startup latency when audio chunk is sent immediately (pending-audio path).","timestamp":1775295905140,"segment":2,"confidence":null,"iterationTokens":134,"asi":{"hypothesis":"Pending-audio startup benchmark better reflects real live usage and guards against overfitting to no-audio ready latency.","baseline_runs":"263,328,371","workload":"start session -> immediate chunk send -> wait ready"}}
{"run":9,"commit":"e35534e","metric":331,"metrics":{},"status":"discard","description":"Tried reducing pending-audio guarded delay default 80->40ms to speed ready under immediate chunk send; no improvement on pending-audio benchmark.","timestamp":1775295934305,"segment":2,"confidence":null,"iterationTokens":878,"asi":{"hypothesis":"Smaller guarded delay should lower pending-audio startup latency.","rollback_reason":"Primary metric regressed (331ms vs 328ms baseline) and variance suggests no reliable gain.","next_action_hint":"Test bypassing guarded delay when ACK already observed/open warm path, or instrument ack-vs-fallback split before tuning constants.","runs":"218,331,410","observation":"Latency spread widened; aggressive guard reduction may increase timing jitter."}}
{"run":10,"commit":"e8fda23","metric":208,"metrics":{},"status":"keep","description":"Added single-chunk guarded delay path (default 25ms) for pending-audio startup: keeps conservative delay for multi-chunk backpressure but speeds common first-chunk live case.","timestamp":1775295976251,"segment":2,"confidence":40,"iterationTokens":1393,"asi":{"hypothesis":"Most live starts have one pending chunk; a shorter guard for this case should improve startup while retaining stability for heavier pending queues.","changes":"New env VOLCENGINE_ASR_INIT_SINGLE_CHUNK_GUARD_MS (default 25) and dynamic pendingGuard selection.","benchmark_runs":"175,208,267","stability_note":"Multi-chunk pending sessions still use full guarded delay, limiting premature flush risk."}}
{"run":11,"commit":"e8fda23","metric":347,"metrics":{},"status":"discard","description":"Tried rolling ACK-latency adaptive fallback (p50-based) for init ready timer; worsened pending-audio startup latency.","timestamp":1775296094998,"segment":2,"confidence":12.631578947368421,"iterationTokens":4819,"asi":{"hypothesis":"Use recent ACK latencies to auto-tune init fallback and reduce startup delay without sacrificing stability.","rollback_reason":"Primary pending-audio metric regressed (347ms vs 328ms baseline).","next_action_hint":"Keep static guarded defaults for now; pursue end-to-end live-turn benchmark and SSE/TTS recovery metrics next.","runs":"178,347,502","learning":"Adaptive fallback introduced extra variance and slower median in this workload."}}
{"run":12,"commit":"39730c2","metric":285,"metrics":{},"status":"keep","description":"Cached static ASR init payload template (app/audio/request base) and only injected per-session uid/reqid to reduce session start object construction overhead.","timestamp":1775296151538,"segment":2,"confidence":6.315789473684211,"iterationTokens":2291,"asi":{"hypothesis":"Reducing per-session init payload allocations and env-derived field assembly lowers pending-audio startup latency.","changes":"Added getStaticInitPayload cache and lightweight buildInitPayload(session).","benchmark_runs":"170,285,393","tradeoff":"No protocol behavior change; relies on process-level static env config."}}
{"run":13,"commit":"7f643e3","metric":181,"metrics":{},"status":"keep","description":"Tuned relay init fallback default 90ms -> 80ms (guarded path unchanged), yielding faster pending-audio startup latency.","timestamp":1775296204361,"segment":2,"confidence":4.523076923076923,"iterationTokens":1779,"asi":{"hypothesis":"After adding single-chunk guard, reducing base fallback to 80ms should cut startup delay without destabilizing pending-flush timing.","changes":"VOLCENGINE_ASR_INIT_FALLBACK_MS default changed to 80ms; guard defaults unchanged.","benchmark_runs":"172,181,268","note":"Still benchmarking pending-audio start path to avoid no-audio overfitting."}}
{"run":14,"commit":"3161fbd","metric":176,"metrics":{},"status":"keep","description":"Further tuned relay init fallback default 80ms -> 70ms for faster pending-audio startup; median improved but with one high-latency outlier.","timestamp":1775296309330,"segment":2,"confidence":2.4516129032258065,"iterationTokens":1779,"asi":{"hypothesis":"Lower base fallback to 70ms should reduce ready latency in common live startup path.","changes":"VOLCENGINE_ASR_INIT_FALLBACK_MS default 70ms; guarded delays unchanged.","benchmark_runs":"161,176,931","outlier_note":"Observed one large outlier (931ms); median still improved vs previous 181ms and baseline 328ms.","next_action_hint":"Re-run same config once to validate variance and ensure gain is stable."}}
{"run":15,"commit":"3161fbd","metric":372,"metrics":{},"status":"discard","description":"Stability re-run of 70ms fallback config regressed heavily; indicates higher variance/instability despite prior fast run.","timestamp":1775296340234,"segment":2,"confidence":2.8679245283018866,"iterationTokens":878,"asi":{"hypothesis":"The 70ms fallback tuning would remain consistently faster across repeated runs.","rollback_reason":"Primary metric worse than baseline in confirmation run (372ms vs 328ms baseline), suggesting unstable benefit.","next_action_hint":"Revert to safer 80ms fallback (or test 75ms) and prioritize end-to-end live-turn benchmark before further micro-tuning.","benchmark_runs":"183,372,390","learning":"70ms appears too aggressive under current network/runtime jitter."}}
{"run":16,"commit":"c59306e","metric":216,"metrics":{},"status":"keep","description":"Reverted fallback default from 70ms back to 80ms after instability check; pending-audio startup recovered to stable improved range.","timestamp":1775296371555,"segment":2,"confidence":2.2028985507246377,"iterationTokens":1498,"asi":{"hypothesis":"80ms fallback provides better stability/latency tradeoff than aggressive 70ms.","changes":"Default INIT_FALLBACK_MS set back to 80ms; guarded delays unchanged.","benchmark_runs":"174,216,269","stability_result":"No extreme outlier observed; substantially better than baseline 328ms."}}
{"run":17,"commit":"9b065fc","metric":180,"metrics":{},"status":"keep","description":"Tuned single-chunk guarded delay default 25ms -> 20ms while keeping fallback at 80ms; improved pending-audio startup latency.","timestamp":1775296406770,"segment":2,"confidence":2.0965517241379312,"iterationTokens":1350,"asi":{"hypothesis":"Slightly shorter single-chunk guard reduces startup wait in common live first-chunk path without destabilizing multi-chunk behavior.","changes":"VOLCENGINE_ASR_INIT_SINGLE_CHUNK_GUARD_MS default changed to 20ms.","benchmark_runs":"167,180,313","stability_note":"Multi-chunk sessions still use full guarded delay (80ms)."}}
{"run":18,"commit":"9b065fc","metric":315,"metrics":{},"status":"discard","description":"Tried single-chunk guard 15ms (from 20ms); significantly worse than current best configuration on pending-audio startup.","timestamp":1775296434186,"segment":2,"confidence":2.2028985507246377,"iterationTokens":1064,"asi":{"hypothesis":"Further reducing single-chunk guard might yield extra startup gains.","rollback_reason":"Metric regressed sharply versus current best (315ms vs 180ms), indicating over-aggressive guard harms stability/latency consistency.","next_action_hint":"Keep 20ms as current sweet spot; move to end-to-end live-turn benchmark and TTS-side reliability metrics.","benchmark_runs":"161,315,357","learning":"Too-small single-chunk guard likely increases timing races/jitter."}}
{"type":"config","name":"Live ASR pending-multi startup stability","metricName":"asr_response_time","metricUnit":"ms","bestDirection":"lower"}
{"run":19,"commit":"a5d1518","metric":302,"metrics":{},"status":"keep","description":"Baseline for anti-overfitting multi-pending workload: startup latency with 3 audio chunks queued before ready.","timestamp":1775296570658,"segment":3,"confidence":null,"iterationTokens":123,"asi":{"hypothesis":"Need a second workload baseline (multi-pending) to ensure tuning generalizes beyond single-chunk startup path.","baseline_runs":"233,302,672","workload":"start session -> queue 3 chunks -> wait ready"}}
{"run":20,"commit":"a5d1518","metric":316,"metrics":{},"status":"discard","description":"Tried lowering multi-pending guarded delay default 80ms -> 70ms; did not improve multi-pending startup latency.","timestamp":1775296597211,"segment":3,"confidence":null,"iterationTokens":964,"asi":{"hypothesis":"Reducing guarded delay for multi-chunk pending could speed startup in buffered scenarios.","rollback_reason":"Primary metric regressed vs multi-pending baseline (316ms vs 302ms).","next_action_hint":"Keep 80ms guarded delay for multi-pending path; explore reducing fallback or improving flush scheduling instead.","benchmark_runs":"240,316,321","learning":"Multi-pending path appears to need more conservative guard for stable startup."}}
{"run":21,"commit":"a5d1518","metric":350,"metrics":{},"status":"discard","description":"Tried lowering base init fallback 80ms -> 70ms for multi-pending workload; caused clear regression.","timestamp":1775296626018,"segment":3,"confidence":null,"iterationTokens":1068,"asi":{"hypothesis":"Reducing base fallback would reduce total wait before ready in multi-pending path.","rollback_reason":"Primary metric worsened significantly vs baseline (350ms vs 302ms).","next_action_hint":"Keep fallback at 80ms for multi-pending stability and avoid further aggressive timing cuts; shift focus to end-to-end turn benchmark and resilience metrics.","benchmark_runs":"222,350,386","learning":"Multi-pending startup is more sensitive to too-early fallback timing."}}
{"run":22,"commit":"a5d1518","metric":335,"metrics":{},"status":"discard","description":"Tried changing guard semantics from additive delay to elapsed-time budget (remaining guard) to reduce multi-pending wait; regressed multi-pending startup latency.","timestamp":1775296712935,"segment":3,"confidence":null,"iterationTokens":2416,"asi":{"hypothesis":"Applying guard as a minimum-from-open budget (instead of adding a second full delay) would lower ready latency for multi-pending sessions.","rollback_reason":"Primary metric worsened versus multi-pending baseline (335ms vs 302ms).","next_action_hint":"Keep current additive guard model; focus next on SSE reconnect resilience and end-to-end turn benchmark instrumentation.","benchmark_runs":"173,335,335","learning":"The elapsed-budget approach likely triggers less favorable backend timing despite lower theoretical wait."}}
{"run":23,"commit":"4a29db4","metric":282,"metrics":{},"status":"keep","description":"Increased multi-pending guarded delay default 80ms -> 90ms to favor startup stability under queued-chunk conditions; improved median on multi-pending workload.","timestamp":1775296759265,"segment":3,"confidence":1.0526315789473684,"iterationTokens":1897,"asi":{"hypothesis":"A slightly more conservative guard for pending>1 chunks can reduce backend timing races and improve stable startup latency.","changes":"VOLCENGINE_ASR_INIT_GUARDED_DELAY_MS default 90ms (fallback 80ms, single-chunk guard 20ms unchanged).","benchmark_runs":"224,282,365","anti_overfit":"Applied on multi-pending benchmark (3 queued chunks), not single-chunk path."}}
{"run":24,"commit":"5892190","metric":252,"metrics":{},"status":"keep","description":"Refined multi-pending timing profile: reduced base fallback 80ms -> 75ms while keeping guarded delay 90ms; improved startup latency on queued-chunk workload.","timestamp":1775296811148,"segment":3,"confidence":1.8867924528301887,"iterationTokens":1919,"asi":{"hypothesis":"With guarded delay increased to 90ms, fallback can be slightly reduced to 75ms for better responsiveness without reintroducing race-related regressions.","changes":"VOLCENGINE_ASR_INIT_FALLBACK_MS default 75ms, VOLCENGINE_ASR_INIT_GUARDED_DELAY_MS 90ms, single-chunk guard 20ms.","benchmark_runs":"231,252,297","anti_overfit":"Validated on multi-pending benchmark (3 queued chunks)."}}
{"run":25,"commit":"5892190","metric":325,"metrics":{},"status":"discard","description":"Confirmation rerun of 75/90/20 timing profile regressed above baseline; prior improvement appears unstable under noise.","timestamp":1775296837654,"segment":3,"confidence":2.6315789473684212,"iterationTokens":847,"asi":{"hypothesis":"The 75ms fallback + 90ms guard config would hold up on repeat multi-pending runs.","rollback_reason":"Repeat run was worse than baseline (325ms vs 302ms), indicating the previous gain was not stable enough.","next_action_hint":"Rollback to 80/90/20 profile and prioritize end-to-end live-turn benchmark + resilience metrics over further micro-timing tweaks.","benchmark_runs":"249,325,438","learning":"Multi-pending timing remains jitter-sensitive; single-run gains can be misleading."}}
{"type":"config","name":"Live ASR mixed-workload startup latency","metricName":"asr_response_time","metricUnit":"ms","bestDirection":"lower"}
{"run":26,"commit":"54079aa","metric":441,"metrics":{},"status":"keep","description":"Baseline for mixed anti-overfitting workload: combined single-pending and multi-pending startup latency (mean of medians).","timestamp":1775296898998,"segment":4,"confidence":null,"iterationTokens":130,"asi":{"hypothesis":"A mixed-workload metric better reflects real live variance and reduces overfitting risk versus single-path tuning.","single_runs":"575,538,266","multi_runs":"233,407,343","single_median":538,"multi_median":343,"metric_definition":"round((single_median + multi_median)/2)"}}
{"run":27,"commit":"f0ed194","metric":286,"metrics":{},"status":"keep","description":"On mixed workload target, set base fallback default back to 80ms (keeping guarded 90ms, single-guard 20ms); substantially improved combined single+multi startup metric.","timestamp":1775297023711,"segment":4,"confidence":null,"iterationTokens":2101,"asi":{"hypothesis":"The previous 75ms default was too aggressive for mixed startup variability; 80ms should improve overall consistency across single and multi pending paths.","changes":"VOLCENGINE_ASR_INIT_FALLBACK_MS default 80ms, VOLCENGINE_ASR_INIT_GUARDED_DELAY_MS 90ms, single-chunk guard 20ms unchanged.","single_runs":"155,422,251","multi_runs":"427,253,321","metric_definition":"mean(single_median,multi_median)","anti_overfit":"Decision based on mixed workload, not a single scenario."}}
{"run":28,"commit":"eb16306","metric":299,"metrics":{},"status":"keep","description":"Mixed-workload confirmation run for 80/90/20 profile remained clearly better than baseline; stabilized configuration retained.","timestamp":1775297055940,"segment":4,"confidence":11.923076923076923,"iterationTokens":1143,"asi":{"hypothesis":"The 80/90/20 timing profile should remain robust on repeated mixed single+multi startup runs.","benchmark_single_runs":"475,259,200","benchmark_multi_runs":"257,344,339","metric_definition":"round((single_median + multi_median)/2)","validation":"Second run still improved vs mixed baseline 441ms."}}
{"run":29,"commit":"dc5a530","metric":168,"metrics":{},"status":"keep","description":"Optimized guard timing by tracking first pending-audio enqueue timestamp and applying only remaining guard delay, reducing unnecessary second-wait before ready.","timestamp":1775297164880,"segment":4,"confidence":4.1679389312977095,"iterationTokens":1122,"asi":{"hypothesis":"Use pending-age-aware guard timing to cut startup latency without bypassing guard safety.","changes":"Added firstPendingAt tracking in session; guard now uses remaining delay = max(0, guard - pendingElapsed).","single_runs":"181,141,360","multi_runs":"155,213,154","metric_definition":"mixed mean(single_median,multi_median)","anti_overfit":"Validated on mixed workload containing both single and multi pending scenarios."}}
{"run":30,"commit":"3619772","metric":215,"metrics":{},"status":"keep","description":"Confirmation rerun for pending-age-aware guard timing remained well below mixed baseline, supporting robustness under variance.","timestamp":1775297179154,"segment":4,"confidence":3.8450704225352115,"iterationTokens":1122,"asi":{"hypothesis":"The new pending-age-aware guard timing should stay improved across repeated mixed-workload runs.","single_runs":"186,286,144","multi_runs":"368,139,243","metric_definition":"mixed mean(single_median,multi_median)","validation":"Second run still significantly better than mixed baseline 441ms, despite normal jitter."}}
