{"run":31,"commit":"2a97710","metric":215,"metrics":{},"status":"keep","description":"Verification pass: production build succeeds after pending-age-aware guard optimization and ideas pruning update.","timestamp":1775297320795,"segment":4,"confidence":6.5,"iterationTokens":1984,"asi":{"hypothesis":"Recent relay timing optimizations should remain build-safe and production-compatible.","validation":"npm run build passed","metric_source":"using latest confirmed mixed-workload measurement (215ms) for tracking continuity."}}
{"type":"config","name":"Live ASR turn-complete mixed latency","metricName":"asr_response_time","metricUnit":"ms","bestDirection":"lower"}
{"run":32,"commit":"2a97710","metric":0,"metrics":{},"status":"crash","description":"Initial turn-complete mixed benchmark crashed because synthetic audio triggered backend 'No valid speeches found in input audio' before clean close.","timestamp":1775297376808,"segment":5,"confidence":null,"iterationTokens":122,"asi":{"hypothesis":"Measure closer-to-end-to-end ASR turn completion latency (start->send chunks->finish->closed).","rollback_reason":"Benchmark workload incompatible with backend speech validation for synthetic fixture, causing crash.","next_action_hint":"Revise benchmark to use no-audio turn completion or fixture-based real speech sample, then re-baseline.","error":"No valid speeches found in input audio"}}
{"type":"config","name":"Live ASR mixed-workload startup latency","metricName":"asr_response_time","metricUnit":"ms","bestDirection":"lower"}
{"run":33,"commit":"ff070c0","metric":144,"metrics":{},"status":"keep","description":"New mixed-workload baseline after gating relay debug logs behind VOLCENGINE_ASR_DEBUG=1 to reduce hot-path console overhead.","timestamp":1775297439257,"segment":6,"confidence":null,"iterationTokens":147,"asi":{"hypothesis":"Suppressing frequent relay logs in hot path should reduce event-loop/stdio overhead and improve startup latency consistency.","changes":"Introduced debugLog helper and disabled normal close/error/decode logs unless VOLCENGINE_ASR_DEBUG=1.","single_runs":"151,134,356","multi_runs":"134,136,224","metric_definition":"round((single_median + multi_median)/2)"}}
{"run":34,"commit":"ff070c0","metric":176,"metrics":{},"status":"discard","description":"Tested fallback default 75ms on mixed workload after log-gating optimization; regressed versus new baseline.","timestamp":1775297487195,"segment":6,"confidence":null,"iterationTokens":1062,"asi":{"hypothesis":"With lower logging overhead, 75ms fallback might further reduce mixed startup latency.","rollback_reason":"Primary metric regressed (176ms vs 144ms baseline).","next_action_hint":"Keep fallback at 80ms; explore non-timing improvements (SSE resilience, TTS stall handling) with separate stability metrics.","single_runs":"337,154,126","multi_runs":"292,124,198","learning":"75ms remains too aggressive under mixed variability even in low-log path."}}
{"run":35,"commit":"ff070c0","metric":506,"metrics":{},"status":"discard","description":"Tried increasing guarded-delay default 90ms -> 95ms to smooth mixed-path jitter; caused severe latency regression.","timestamp":1775297540051,"segment":6,"confidence":null,"iterationTokens":1390,"asi":{"hypothesis":"Slightly longer guard might improve mixed stability under queued chunks.","rollback_reason":"Primary metric catastrophically regressed (506ms vs 144ms baseline).","next_action_hint":"Keep guarded-delay at 90ms and avoid further upward tuning; focus on resilience features and fixture-based end-to-end benchmark next.","single_runs":"136,480,507","multi_runs":"531,579,463","learning":"Overly conservative guard can dramatically hurt both single and multi startup medians."}}
{"run":36,"commit":"ff070c0","metric":223,"metrics":{},"status":"discard","description":"Tried opportunistic ready scheduling from first pending chunk arrival (before open-fallback checkpoint); mixed-workload metric regressed.","timestamp":1775297737813,"segment":6,"confidence":null,"iterationTokens":396,"asi":{"hypothesis":"Scheduling ready from first pending chunk arrival can remove extra wait and reduce startup latency.","rollback_reason":"Primary metric regressed strongly (223ms vs 144ms baseline).","next_action_hint":"Revert opportunistic early-ready path; keep pending-age-aware guard only. Then optimize non-timing hot paths or add resilience metrics.","single_runs":"279,153,329","multi_runs":"166,211,163","note":"One earlier run timed out (likely transient), confirmation run still clearly worse."}}
{"run":37,"commit":"ff070c0","metric":198,"metrics":{},"status":"discard","description":"Tried caching parsed timing envs (init/guard/single-guard) to reduce per-session Number parsing overhead; mixed metric regressed.","timestamp":1775297788875,"segment":6,"confidence":null,"iterationTokens":2058,"asi":{"hypothesis":"Caching timing config values would shave setup overhead and improve startup latency.","rollback_reason":"Primary mixed metric regressed (198ms vs 144ms baseline).","next_action_hint":"Keep current implementation; pursue benchmark realism (real speech fixture) and resilience changes with separate metrics.","single_runs":"265,154,326","multi_runs":"131,335,127","learning":"Micro-optimization impact is dominated by network jitter; no reliable gain."}}
{"run":38,"commit":"ff070c0","metric":168,"metrics":{},"status":"discard","description":"Noise-check rerun on unchanged mixed-workload config came in above best baseline; no new optimization signal.","timestamp":1775297833546,"segment":6,"confidence":null,"iterationTokens":910,"asi":{"hypothesis":"Re-running unchanged config helps estimate variance/confidence before new changes.","rollback_reason":"No primary improvement (168ms vs 144ms baseline).","next_action_hint":"Proceed with larger-signal changes only (e.g., real-speech fixture benchmark and resilience-focused optimizations).","single_runs":"151,176,306","multi_runs":"150,215,159","learning":"Current mixed-workload has non-trivial jitter; prioritize robust improvements over micro-tuning."}}
{"type":"config","name":"Live ASR turn-complete latency (real speech fixture)","metricName":"asr_response_time","metricUnit":"ms","bestDirection":"lower"}
{"run":39,"commit":"ff070c0","metric":0,"metrics":{},"status":"crash","description":"Initial real-speech turn benchmark failed: fixture generation used invalid macOS voice name (Ting-Ting).","timestamp":1775297926149,"segment":7,"confidence":null,"iterationTokens":133,"asi":{"hypothesis":"Use real speech fixture to benchmark turn-complete latency and avoid synthetic-audio validation failures.","rollback_reason":"Benchmark setup crash due to invalid TTS voice identifier.","next_action_hint":"Switch fixture generator to available voice 'Tingting' and rerun baseline.","error":"Voice `Ting-Ting` not found"}}
{"run":40,"commit":"9c91872","metric":1202,"metrics":{},"status":"keep","description":"Baseline established for real-speech turn-complete mixed latency benchmark (short utterance + full utterance).","timestamp":1775297991827,"segment":7,"confidence":null,"iterationTokens":2463,"asi":{"hypothesis":"Real speech fixture benchmark provides more realistic end-to-end ASR turn timing and avoids synthetic-audio validation artifacts.","short_turn_runs":"483,2470,295","full_turn_runs":"1920,1354,2102","short_turn_median":483,"full_turn_median":1920,"metric_definition":"round((short_median + full_median)/2)"}}
{"run":41,"commit":"bfd8541","metric":854,"metrics":{},"status":"keep","description":"Optimized finish path for pending sessions: reuse last pending audio chunk as terminal frame instead of appending extra empty final chunk.","timestamp":1775298046951,"segment":7,"confidence":null,"iterationTokens":1567,"asi":{"hypothesis":"Removing redundant empty terminal frame in pending path should reduce turn-complete latency, especially for longer utterances.","changes":"finishRealtimeAsrSession now marks last pending audio chunk isLast=true when available.","short_turn_runs":"397,288,482","full_turn_runs":"1209,1311,2047","metric_definition":"round((short_median + full_median)/2)","anti_overfit":"Measured on real speech fixture with both short and full utterance scenarios."}}
{"run":42,"commit":"bfd8541","metric":1303,"metrics":{},"status":"discard","description":"Confirmation run of pending-finish optimization regressed heavily on real-speech turn-complete benchmark; improvement not stable.","timestamp":1775298074680,"segment":7,"confidence":8.455445544554456,"iterationTokens":743,"asi":{"hypothesis":"Reusing last pending audio chunk as terminal frame would consistently improve turn-complete latency.","rollback_reason":"Follow-up run worse than prior baseline trend (1303ms), indicating high instability or adverse effect under realistic full utterance path.","next_action_hint":"Revert this change; next focus on benchmark robustness (more runs/trimmed median) and relay/session error-path reductions.","short_turn_runs":"586,479,369","full_turn_runs":"2244,2127,2013","learning":"Real-speech turn-complete metric has high variance; single-run gains are unreliable."}}
{"type":"config","name":"Live ASR turn-complete latency (real speech fixture, 5-run robust)","metricName":"asr_response_time","metricUnit":"ms","bestDirection":"lower"}
{"run":43,"commit":"6f0bc81","metric":1340,"metrics":{},"status":"keep","description":"Baseline for robust real-speech turn-complete benchmark updated to 5 runs per scenario (short/full utterance).","timestamp":1775298142249,"segment":8,"confidence":null,"iterationTokens":138,"asi":{"hypothesis":"Using 5-run medians reduces decision noise for high-variance real-speech turn latency optimization.","short_turn_runs":"529,626,506,565,371","full_turn_runs":"2419,2000,2151,2059,2202","short_turn_median":529,"full_turn_median":2151,"metric_definition":"round((short_median + full_median)/2), runs=5"}}
{"type":"config","name":"Live ASR turn-complete latency (real speech, transcript-required)","metricName":"asr_response_time","metricUnit":"ms","bestDirection":"lower"}
{"run":44,"commit":"c78dbd8","metric":876,"metrics":{},"status":"keep","description":"Baseline for real-speech turn-complete benchmark with transcript-required validation (full utterance must produce transcript).","timestamp":1775298301214,"segment":9,"confidence":null,"iterationTokens":135,"asi":{"hypothesis":"Adding transcript-required constraint prevents benchmark over-optimization that could sacrifice ASR correctness.","short_turn_runs":"389,367,448,413,480","full_turn_runs":"1176,1316,1724,3216,1339","short_turn_median":413,"full_turn_median":1339,"metric_definition":"round((short_median + full_median)/2), runs=5, full_requires_transcript=true"}}
{"run":45,"commit":"c78dbd8","metric":1271,"metrics":{},"status":"discard","description":"Tried direct websocket close on finish (open+initAck+sentAudio) instead of sending terminal empty frame; real-speech transcript-required turn latency regressed.","timestamp":1775298355778,"segment":9,"confidence":null,"iterationTokens":1450,"asi":{"hypothesis":"Skipping terminal empty frame in open session could reduce end-of-turn overhead.","rollback_reason":"Primary metric regressed severely (1271ms vs 876ms baseline).","next_action_hint":"Keep protocol-compliant terminal frame path for open sessions; explore buffering/chunk cadence optimizations instead.","short_turn_runs":"765,536,473,469,418","full_turn_runs":"2068,1965,3486,3448,1818","learning":"Direct close likely hurts backend finalization behavior and increases latency variance."}}
{"type":"config","name":"Live ASR turn-complete latency (real speech paced send)","metricName":"asr_response_time","metricUnit":"ms","bestDirection":"lower"}
{"run":46,"commit":"124a6d2","metric":2191,"metrics":{},"status":"keep","description":"Baseline for paced real-speech turn-complete benchmark (send pace 60ms/chunk) to better mimic live streaming behavior.","timestamp":1775298430205,"segment":10,"confidence":null,"iterationTokens":134,"asi":{"hypothesis":"Paced chunk sending yields a more realistic and less burst-sensitive end-to-end turn metric.","short_turn_runs":"858,752,642,382,339","full_turn_runs":"3740,3972,3724,3745,3689","send_pace_ms":60,"metric_definition":"round((short_median + full_median)/2), runs=5, full_requires_transcript=true"}}
{"run":47,"commit":"124a6d2","metric":2182,"metrics":{},"status":"discard","description":"Lowered default VAD silence/start thresholds (2000->1200, 10000->8000) showed only marginal single-run gain on paced real-speech turn benchmark.","timestamp":1775298532448,"segment":10,"confidence":null,"iterationTokens":303,"asi":{"hypothesis":"Smaller VAD silence defaults should reduce end-of-turn latency.","rollback_reason":"Improvement was tiny and likely within noise; required confirmation before keep.","next_action_hint":"Use confirmation run; keep only if repeated improvement is clear.","short_turn_runs":"378,723,654,496,563","full_turn_runs":"3801,3781,4135,3967,3797","learning":"Tail latency remains dominated by full-turn backend timing; default VAD tweak alone may not move median reliably."}}
{"run":48,"commit":"124a6d2","metric":2200,"metrics":{},"status":"discard","description":"Confirmation run for reduced VAD defaults regressed above baseline, confirming no reliable benefit.","timestamp":1775298540895,"segment":10,"confidence":null,"iterationTokens":303,"asi":{"hypothesis":"Reduced VAD defaults would consistently lower paced real-speech turn latency.","rollback_reason":"Confirmation metric regressed (2200ms vs 2191ms baseline), so prior tiny gain was noise.","next_action_hint":"Abandon VAD default micro-tuning; target larger-signal changes such as client-side final-chunk signaling and SSE resilience.","short_turn_runs":"2559,457,523,497,544","full_turn_runs":"3906,3955,3876,3729,3792","learning":"High short-turn outlier indicates instability; not suitable for keep."}}
{"type":"config","name":"Live ASR turn-complete latency (real speech paced, final-chunk signaling)","metricName":"asr_response_time","metricUnit":"ms","bestDirection":"lower"}
{"run":49,"commit":"63cde9c","metric":2176,"metrics":{},"status":"keep","description":"Baseline for paced real-speech turn benchmark using final-chunk signaling (isLast on last audio chunk, transcript required for full path).","timestamp":1775298653206,"segment":11,"confidence":null,"iterationTokens":143,"asi":{"hypothesis":"Final-chunk signaling may remove finish-phase overhead while preserving transcript correctness; establish dedicated baseline first.","short_turn_runs":"1068,651,496,551,397","full_turn_runs":"3800,3743,3801,3687,3800","send_pace_ms":60,"metric_definition":"round((short_median + full_median)/2), runs=5"}}
{"run":50,"commit":"63cde9c","metric":2048,"metrics":{},"status":"discard","description":"Tried immediate ready flush when terminal pending chunk exists; initial run improved but required confirmation due high variance.","timestamp":1775298750572,"segment":11,"confidence":null,"iterationTokens":264,"asi":{"hypothesis":"If isLast chunk is already pending, skipping startup guard can reduce turn-complete latency without harming transcript completion.","rollback_reason":"Single-run improvement was not trusted under high variance; confirmation required before keep.","next_action_hint":"If confirmation regresses, keep prior behavior; otherwise re-test with larger sample size.","short_turn_runs":"541,397,496,400,395","full_turn_runs":"3669,3845,3696,3653,5037","learning":"Full-turn path remains noisy with occasional long-tail spikes."}}
{"run":51,"commit":"63cde9c","metric":2192,"metrics":{},"status":"discard","description":"Confirmation run for terminal-pending immediate flush regressed above baseline; optimization rejected.","timestamp":1775298760513,"segment":11,"confidence":null,"iterationTokens":264,"asi":{"hypothesis":"Terminal-pending immediate flush would consistently reduce paced real-speech turn latency.","rollback_reason":"Confirmation metric regressed (2192ms vs 2176ms baseline).","next_action_hint":"Drop this branch; prioritize variance reduction and stability instrumentation instead of more aggressive flush shortcuts.","short_turn_runs":"438,536,372,660,241","full_turn_runs":"3945,5646,3792,3703,4349","learning":"Terminal-flush shortcut increases tail risk in full-turn path."}}
{"run":52,"commit":"2b36c28","metric":2022,"metrics":{},"status":"keep","description":"Removed nlu_punctuate from ASR workflow in relay/client init payload to reduce realtime decode/post-processing latency.","timestamp":1775298861622,"segment":11,"confidence":2.138888888888889,"iterationTokens":267,"asi":{"hypothesis":"Skipping punctuation stage should reduce end-of-turn latency while still preserving transcript output for downstream chat.","changes":"workflow changed from audio_in,resample,partition,vad,fe,decode,itn,nlu_punctuate -> audio_in,resample,partition,vad,fe,decode,itn","short_turn_runs":"404,399,390,631,369","full_turn_runs":"3685,3644,3622,3616,3799","quality_guard":"Benchmark still requires transcript on full-turn scenario."}}
{"run":53,"commit":"5171e8b","metric":2067,"metrics":{},"status":"keep","description":"Confirmation run for workflow simplification remained below paced real-speech baseline, supporting stable latency gain.","timestamp":1775298869872,"segment":11,"confidence":3.422222222222222,"iterationTokens":267,"asi":{"hypothesis":"Workflow without nlu_punctuate consistently improves turn-complete latency under paced real-speech load.","short_turn_runs":"986,253,406,403,390","full_turn_runs":"3797,3666,3782,3647,3730","validation":"Second run still better than baseline 2176ms despite normal variance."}}
{"run":54,"commit":"436249e","metric":2062,"metrics":{},"status":"keep","description":"Additional confirmation run for workflow simplification stayed below paced real-speech baseline; retained and documented in ideas backlog.","timestamp":1775298935795,"segment":11,"confidence":5.220338983050848,"iterationTokens":1816,"asi":{"hypothesis":"Workflow simplification gains should persist across repeated paced real-speech runs.","short_turn_runs":"409,467,290,637,392","full_turn_runs":"3791,3682,4376,3714,3642","validation":"Third run still below baseline 2176ms; ideas backlog updated with observed result."}}
{"run":55,"commit":"4bdeccf","metric":2072,"metrics":{},"status":"keep","description":"Simplified ASR workflow further by removing `itn` stage (`...decode` only) in relay/client init payload; paced real-speech turn metric remains improved vs baseline.","timestamp":1775299036836,"segment":11,"confidence":8.105263157894736,"iterationTokens":1816,"asi":{"hypothesis":"Dropping ITN post-processing may reduce end-of-turn latency while still keeping transcript availability for chat.","changes":"workflow changed from audio_in,resample,partition,vad,fe,decode,itn -> audio_in,resample,partition,vad,fe,decode","short_turn_runs":"459,257,427,498,267","full_turn_runs":"3824,3654,3782,3641,3716","quality_guard":"Benchmark requires transcript on full utterance scenario."}}
{"run":56,"commit":"403c5a4","metric":2015,"metrics":{},"status":"keep","description":"Confirmation run for decode-only workflow (without itn/nlu_punctuate) further improved paced real-speech turn latency.","timestamp":1775299148006,"segment":11,"confidence":5.4576271186440675,"iterationTokens":821,"asi":{"hypothesis":"Decode-only workflow should consistently reduce turn-complete latency under paced real-speech load.","short_turn_runs":"323,521,393,367,486","full_turn_runs":"3684,3616,3610,3751,3637","validation":"Second run stayed below baseline 2176ms and below prior decode-only run.","note":"Transcript presence requirement still satisfied for full scenario."}}
{"run":57,"commit":"e25fb67","metric":2015,"metrics":{},"status":"keep","description":"Verification pass: production build succeeds after decode-only ASR workflow change; ideas backlog updated with confirmed finding.","timestamp":1775299276224,"segment":11,"confidence":4.025,"iterationTokens":1325,"asi":{"hypothesis":"Workflow simplification should remain production-safe while preserving latency gains.","validation":"npm run build passed","metric_source":"latest confirmed paced real-speech turn-complete metric 2015ms","docs_update":"autoresearch.ideas.md updated to reflect decode-only workflow observation."}}
{"run":58,"commit":"8265c9f","metric":2071,"metrics":{},"status":"keep","description":"Disabled utterance-level segmentation in ASR request (`show_utterances=false`) to reduce response payload/processing overhead in realtime path.","timestamp":1775299395962,"segment":11,"confidence":5.4576271186440675,"iterationTokens":270,"asi":{"hypothesis":"Turning off utterance list generation can reduce turn-complete latency while preserving top-level transcript text.","changes":"show_utterances true -> false in relay/client ASR init payload.","short_turn_runs":"339,409,634,653,416","full_turn_runs":"3945,3692,3725,3635,3725","quality_guard":"Full scenario still required transcript; remained satisfied."}}
{"run":59,"commit":"abf6e80","metric":2068,"metrics":{},"status":"keep","description":"Confirmation run for `show_utterances=false` remained improved vs paced real-speech baseline, supporting stable gain.","timestamp":1775299406227,"segment":11,"confidence":8.473684210526315,"iterationTokens":270,"asi":{"hypothesis":"Utterance-segmentation disablement should consistently reduce turn-complete latency.","short_turn_runs":"398,659,860,382,405","full_turn_runs":"3788,3992,3650,3731,3654","validation":"Second run still below baseline 2176ms and aligned with prior improved result."}}
