{"run":60,"commit":"abf6e80","metric":2101,"metrics":{},"status":"discard","description":"Tested `vad_signal=false` to trim VAD signaling overhead; regressed against current improved configuration.","timestamp":1775299454024,"segment":11,"confidence":6.0754716981132075,"iterationTokens":1326,"asi":{"hypothesis":"Disabling vad_signal might reduce metadata/processing overhead and lower turn latency.","rollback_reason":"Primary metric worsened versus current best configuration (2101ms vs ~2068ms).","next_action_hint":"Keep vad_signal enabled; explore chunk pacing/adaptive send cadence and SSE/TTS stability instrumentation next.","short_turn_runs":"526,489,436,522,390","full_turn_runs":"3773,3675,3713,4227,3639","learning":"VAD signaling likely contributes useful backend turn handling; removing it hurt median."}}
{"run":61,"commit":"abf6e80","metric":2106,"metrics":{},"status":"discard","description":"Tested leaner workflow `audio_in,vad,fe,decode` (removed resample/partition); regressed against current best paced real-speech turn latency.","timestamp":1775299608251,"segment":11,"confidence":4.878787878787879,"iterationTokens":1983,"asi":{"hypothesis":"Dropping resample/partition stages could reduce backend pipeline latency for already-normalized audio.","rollback_reason":"Primary metric worsened vs current best (~2015ms).","next_action_hint":"Keep workflow with resample+partition; focus on transport/session stability features with measurable latency impact.","short_turn_runs":"485,429,511,387,631","full_turn_runs":"3821,3726,3650,3731,3648","learning":"Resample/partition likely contributes backend pipeline stability even for normalized input."}}
{"run":62,"commit":"abf6e80","metric":2149,"metrics":{},"status":"discard","description":"Retested lower default vad_silence_time (2000->1500) under current decode-only workflow; regressed paced real-speech turn latency.","timestamp":1775299688300,"segment":11,"confidence":4.735294117647059,"iterationTokens":2028,"asi":{"hypothesis":"Slightly lower VAD silence timeout might shorten end-of-turn latency with current workflow settings.","rollback_reason":"Primary metric regressed (2149ms vs ~2015ms current best).","next_action_hint":"Keep default 2000 unless explicitly configured by environment; prioritize transport/reliability optimizations instead.","short_turn_runs":"480,394,678,368,625","full_turn_runs":"3694,3827,4234,3684,3818","learning":"Lower VAD silence threshold increased full-turn median/tail in this workload."}}
{"run":63,"commit":"abf6e80","metric":2159,"metrics":{},"status":"discard","description":"Tested workflow without VAD stage (`audio_in,resample,partition,fe,decode`); regressed paced real-speech turn latency.","timestamp":1775299813687,"segment":11,"confidence":4.6,"iterationTokens":1646,"asi":{"hypothesis":"Removing VAD from backend workflow could reduce processing overhead when client already signals end-of-turn.","rollback_reason":"Primary metric regressed versus current improved config (~2015ms).","next_action_hint":"Keep VAD stage in workflow; focus on transport-side improvements and stability instrumentation.","short_turn_runs":"485,548,496,538,531","full_turn_runs":"3684,3649,3786,3824,4194","learning":"VAD stage likely still helps backend segmentation/finalization efficiency."}}
{"run":64,"commit":"abf6e80","metric":2168,"metrics":{},"status":"discard","description":"Tried disabling websocket per-message deflate on relay client connection; no latency benefit on paced real-speech turn benchmark.","timestamp":1775299934806,"segment":11,"confidence":3.8333333333333335,"iterationTokens":2555,"asi":{"hypothesis":"Turning off ws compression may reduce realtime framing overhead and improve turn latency.","rollback_reason":"Primary metric regressed vs current improved config (~2015ms).","next_action_hint":"Keep default ws transport settings; continue with higher-leverage protocol/workflow changes.","short_turn_runs":"416,492,408,402,246","full_turn_runs":"3943,3668,3958,3927,3747","learning":"Compression setting is not a dominant factor for this ASR workload."}}
{"run":65,"commit":"abf6e80","metric":2039,"metrics":{},"status":"discard","description":"Tried removing explicit `nbest` from ASR request payload (rely on service default); no improvement over current best decode-only config.","timestamp":1775300083797,"segment":11,"confidence":4.6,"iterationTokens":1745,"asi":{"hypothesis":"Eliding optional nbest field might trim backend selection overhead.","rollback_reason":"Metric remained above current best (~2015ms), improvement not demonstrated.","next_action_hint":"Keep explicit/known-good request shape; focus on high-signal optimizations only.","short_turn_runs":"382,423,367,504,503","full_turn_runs":"3960,3606,3601,3654,3674","learning":"nbest field presence is not a meaningful latency lever here."}}
{"run":66,"commit":"abf6e80","metric":2020,"metrics":{},"status":"discard","description":"Tried terminal-pending guard cap (min 10ms) to accelerate end-of-turn startup flush; improved vs baseline but did not beat current best decode-only+show_utterances=false config.","timestamp":1775300239541,"segment":11,"confidence":3.8333333333333335,"iterationTokens":263,"asi":{"hypothesis":"When pending already contains final chunk, aggressively capping guard delay could reduce turn-complete latency.","rollback_reason":"No primary improvement over current best (~2015ms); confirmation run also weaker (2055ms).","next_action_hint":"Revert this cap; keep existing guard behavior and shift to reliability-oriented optimizations or richer E2E benchmarking.","run1":"short_med=357,full_med=3683,metric=2020","run2":"short_med=402,full_med=3708,metric=2055","learning":"Terminal-aware micro-cap reduces some waits but not enough to improve stable median."}}
{"type":"config","name":"Live ASR real-speech stability rate","metricName":"asr_stability_rate","metricUnit":"","bestDirection":"higher"}
{"run":67,"commit":"0ac35be","metric":100,"metrics":{},"status":"keep","description":"Baseline for real-speech ASR stability benchmark (10 paced turns, transcript-required success criterion).","timestamp":1775300372077,"segment":12,"confidence":null,"iterationTokens":123,"asi":{"hypothesis":"Track stability directly via success rate to avoid overfitting only latency metrics.","success":"10/10","metric_definition":"asr_stability_rate = success/total * 100","note":"Metric saturated at 100%; next step is harder stress workload to expose failure headroom."}}
{"type":"config","name":"Live ASR real-speech stability rate (stress workload)","metricName":"asr_stability_rate","metricUnit":"","bestDirection":"higher"}
{"type":"config","name":"Live ASR real-speech stability rate (strict timeout)","metricName":"asr_stability_rate","metricUnit":"","bestDirection":"higher"}
{"type":"config","name":"Live ASR real-speech stability rate (hard timeout 3500ms)","metricName":"asr_stability_rate","metricUnit":"","bestDirection":"higher"}
{"run":68,"commit":"2af7c95","metric":50,"metrics":{},"status":"keep","description":"Baseline for strict stability target: 30 real-speech turns with hard timeout 3500ms yields 50% success.","timestamp":1775300663782,"segment":15,"confidence":null,"iterationTokens":141,"asi":{"hypothesis":"A harder timeout-based stability target creates optimization headroom where normal settings saturate at 100%.","success":"15/30","timeout_ms":3500,"workload":"alternating short/full real-speech turns, paced send=60ms, transcript-required"}}
{"run":69,"commit":"2af7c95","metric":50,"metrics":{},"status":"discard","description":"Tested terminal-pending guard cap (10ms) under strict stability workload (30 turns, 3500ms timeout); no stability gain.","timestamp":1775300872783,"segment":15,"confidence":null,"iterationTokens":2318,"asi":{"hypothesis":"Reducing guard when terminal chunk already pending might increase on-time completions under hard timeout.","rollback_reason":"Primary stability metric unchanged at baseline (50%).","next_action_hint":"Try robustness-oriented changes (retry/fallback behavior on relay error) rather than guard micro-tuning.","success":"15/30","learning":"Guard cap did not affect timeout-bounded success rate on this workload."}}
{"type":"config","name":"Live ASR turn-complete latency (paced real speech, transcript-required)","metricName":"asr_response_time","metricUnit":"ms","bestDirection":"lower"}
{"run":70,"commit":"1717185","metric":2084,"metrics":{},"status":"keep","description":"Baseline reset for paced real-speech turn-complete latency after strict-stability detour.","timestamp":1775300947925,"segment":16,"confidence":null,"iterationTokens":136,"asi":{"hypothesis":"Resume latency optimization track with transcript-required real-speech benchmark as primary metric.","short_turn_runs":"487,504,472,634,491","full_turn_runs":"3707,3651,3677,3930,3671","metric_definition":"round((short_median + full_median)/2), runs=5, send_pace=60ms"}}
{"run":71,"commit":"1717185","metric":2144,"metrics":{},"status":"discard","description":"Retested lower default start_silence_time (10000->8000) under current decode-only + show_utterances=false config; regressed paced turn latency.","timestamp":1775301042959,"segment":16,"confidence":null,"iterationTokens":1009,"asi":{"hypothesis":"Reducing start_silence default might trim early-stage waiting and improve turn completion.","rollback_reason":"Primary metric worsened (2144ms vs 2084ms baseline).","next_action_hint":"Keep start_silence default at 10000 unless env-tuned per deployment.","short_turn_runs":"484,551,405,639,387","full_turn_runs":"3803,3689,3830,4079,3761","learning":"Lower start_silence increased full-turn median in this benchmark."}}
{"run":72,"commit":"1717185","metric":1954,"metrics":{},"status":"discard","description":"Refactored transcript text extraction to low-allocation fast-paths (first-result priority, loop scan) to reduce per-frame CPU overhead; initial run improved but required confirmation.","timestamp":1775301160042,"segment":16,"confidence":null,"iterationTokens":243,"asi":{"hypothesis":"Lower-allocation transcript extraction in relay message handler can reduce event-loop overhead and improve turn latency.","rollback_reason":"Single-run gain was not trusted under high-variance workload; confirmation required.","next_action_hint":"If confirmation regresses, keep simpler proven version; only reattempt with broader profiling evidence.","run1":"short_med=292,full_med=3615,metric=1954","learning":"Possible short-path gain, but needs repeatability."}}
{"run":73,"commit":"1717185","metric":2121,"metrics":{},"status":"discard","description":"Confirmation run for transcript extraction micro-optimization regressed above baseline; optimization rejected.","timestamp":1775301172713,"segment":16,"confidence":null,"iterationTokens":243,"asi":{"hypothesis":"Transcript extraction refactor would consistently reduce turn-complete latency.","rollback_reason":"Confirmation metric worse than baseline (2121ms vs 2084ms), indicating no reliable gain.","next_action_hint":"Abandon extraction micro-tuning for now; prioritize higher-signal protocol/workflow changes.","run2":"short_med=505,full_med=3736,metric=2121","learning":"This workload remains jitter-prone; micro CPU tweaks do not produce stable wins."}}
{"run":74,"commit":"d83db8e","metric":2075,"metrics":{},"status":"keep","description":"Tuned guarded delay default 90ms -> 85ms for startup readiness; slight improvement on paced real-speech turn-complete benchmark.","timestamp":1775301323982,"segment":16,"confidence":0.24324324324324326,"iterationTokens":12659,"asi":{"hypothesis":"A small reduction in guarded delay may reduce startup wait without destabilizing full-turn latency.","changes":"VOLCENGINE_ASR_INIT_GUARDED_DELAY_MS default 85ms (fallback 80ms, single-chunk guard 20ms unchanged).","result":"metric improved marginally vs current baseline (2084 -> 2075)","next_action_hint":"Run confirmation to verify this small gain is real under benchmark noise."}}
{"run":75,"commit":"d83db8e","metric":2091,"metrics":{},"status":"discard","description":"Confirmation run for guarded-delay=85ms regressed above baseline; prior tiny gain was noise.","timestamp":1775301370138,"segment":16,"confidence":0.391304347826087,"iterationTokens":1092,"asi":{"hypothesis":"guarded-delay 85ms would produce consistent latency gain over 90ms.","rollback_reason":"Follow-up run regressed (2091ms), confirming previous -0.4% delta was within noise.","next_action_hint":"Revert to 90ms guarded delay and focus on larger-signal changes.","short_turn_runs":"229,483,499,724,360","full_turn_runs":"4054,4280,3698,3631,3683","learning":"Micro-tuning guarded delay around 90ms is unstable under paced real-speech benchmark."}}
{"run":76,"commit":"b1a68e0","metric":2035,"metrics":{},"status":"keep","description":"Removed explicit `result_type: single` from ASR request payload (relay/client), relying on service default while keeping transcript-required benchmark constraints.","timestamp":1775301440235,"segment":16,"confidence":1.3243243243243243,"iterationTokens":1291,"asi":{"hypothesis":"Eliding explicit result_type may reduce backend response-shaping overhead and improve turn latency.","changes":"Deleted result_type field from relay and client init payloads.","short_turn_runs":"540,401,501,247,359","full_turn_runs":"3771,3597,3742,3599,3668","next_action_hint":"Run confirmation to ensure gain is stable under variance."}}
{"run":77,"commit":"4187e73","metric":2023,"metrics":{},"status":"keep","description":"Confirmation run for removing explicit result_type remained improved vs baseline and previous run, indicating stable gain.","timestamp":1775301480618,"segment":16,"confidence":1.4186046511627908,"iterationTokens":736,"asi":{"hypothesis":"Service default result_type behavior yields slightly lower turn latency than explicit single setting.","short_turn_runs":"432,335,451,408,298","full_turn_runs":"3626,3637,3683,3628,3721","validation":"Second run improved to 2023ms and remained transcript-valid for full scenario."}}
{"run":78,"commit":"4187e73","metric":2158,"metrics":{},"status":"discard","description":"Tested removing explicit `sequence` field from ASR request payload (relay/client); regressed paced real-speech turn latency.","timestamp":1775301584720,"segment":16,"confidence":1.2448979591836735,"iterationTokens":3129,"asi":{"hypothesis":"Eliding sequence field might reduce backend request parsing overhead.","rollback_reason":"Primary metric worsened (2158ms vs 2084ms baseline and ~2023 best).","next_action_hint":"Keep explicit sequence for protocol clarity; avoid further low-level request-shape stripping without strong evidence.","short_turn_runs":"561,389,417,538,745","full_turn_runs":"4226,3697,3781,3625,3777","learning":"Sequence field removal negatively affected latency consistency in this workload."}}
{"run":79,"commit":"a415061","metric":1979,"metrics":{},"status":"keep","description":"Reintroduced explicit `result_type: single` while retaining decode-only + show_utterances=false workflow; achieved best paced real-speech turn latency so far.","timestamp":1775301647328,"segment":16,"confidence":2.0792079207920793,"iterationTokens":1350,"asi":{"hypothesis":"Service default for result_type was not optimal; explicitly requesting single-result mode can reduce full-turn tail latency.","changes":"Added result_type: 'single' back to relay/client request payload.","short_turn_runs":"294,295,435,312,355","full_turn_runs":"3607,3616,3667,4276,3645","note":"Keeps transcript-required guardrail; no quality bypass."}}
{"run":80,"commit":"14b7f1c","metric":2027,"metrics":{},"status":"keep","description":"Confirmation run for explicit `result_type: single` remained improved versus baseline under paced real-speech workload.","timestamp":1775301689854,"segment":16,"confidence":2.1875,"iterationTokens":694,"asi":{"hypothesis":"Explicit single-result mode yields consistent latency benefit over relying on default result_type behavior.","short_turn_runs":"313,359,452,362,527","full_turn_runs":"3662,3749,3675,3695,3691","validation":"Second run stayed below baseline 2084ms; gain persists under variance."}}
{"run":81,"commit":"14b7f1c","metric":0,"metrics":{},"status":"crash","description":"Build verification failed due overly strict literal typing in relay static payload type after request-shape changes (`show_utterances` expected true literal).","timestamp":1775301771467,"segment":16,"confidence":2.1875,"iterationTokens":844,"asi":{"hypothesis":"Current optimized ASR config should remain build-safe.","rollback_reason":"Type-level mismatch caused compile failure; must fix type definitions before further runs.","next_action_hint":"Relax StaticInitPayload requestBase literal types (boolean/number) and re-run build + benchmark.","error_context":"show_utterances false not assignable to literal true"}}
{"run":82,"commit":"14b7f1c","metric":2154,"metrics":{},"status":"discard","description":"Type-relaxation patch for relay static payload compiled in runtime benchmark but did not improve latency on this run.","timestamp":1775301847563,"segment":16,"confidence":1.926605504587156,"iterationTokens":2378,"asi":{"hypothesis":"Relaxing over-strict TypeScript literals should be runtime-neutral and preserve latency.","rollback_reason":"Primary metric above baseline on this sample (2154ms vs 2084ms), no measurable gain.","next_action_hint":"Reapply compile-safety type fix and validate with build + additional benchmark samples to separate noise from runtime impact.","short_turn_runs":"1062,512,391,655,392","full_turn_runs":"3799,3675,3796,4253,3666","learning":"Runtime variance dominates this non-behavioral change; handle as correctness fix with explicit verification."}}
{"run":83,"commit":"14b7f1c","metric":2177,"metrics":{},"status":"discard","description":"Second attempt to land type-relaxation change showed regression in this sample; no latency win observed.","timestamp":1775301905166,"segment":16,"confidence":1.75,"iterationTokens":1286,"asi":{"hypothesis":"Compile-safety type relaxation should be neutral; any latency movement likely noise.","rollback_reason":"Measured metric above baseline (2177ms), no primary improvement.","next_action_hint":"Treat type-fix separately from latency optimization: land with build-validation when running a dedicated correctness pass.","short_turn_runs":"654,628,426,644,500","full_turn_runs":"3830,3637,3779,3649,3726","learning":"Benchmark jitter is too high to evaluate non-runtime type-only changes via latency metric."}}
{"type":"config","name":"Live ASR strict stability rate (3500ms timeout, current optimized config)","metricName":"asr_stability_rate","metricUnit":"","bestDirection":"higher"}
{"run":84,"commit":"14b7f1c","metric":50,"metrics":{},"status":"discard","description":"Retested aggressive fallback (70ms) under strict stability workload (3500ms timeout); no improvement in success rate.","timestamp":1775302184613,"segment":17,"confidence":null,"iterationTokens":2704,"asi":{"hypothesis":"Lower fallback might increase on-time completions under hard timeout.","rollback_reason":"Stability metric unchanged at baseline (50%).","next_action_hint":"Stop fallback micro-tuning for stability target; explore error-recovery semantics and client retry policy.","success":"15/30","learning":"Strict stability is not sensitive to this fallback tweak."}}
{"run":85,"commit":"14b7f1c","metric":50,"metrics":{},"status":"discard","description":"Tested early pending flush on websocket open (skip waiting for ack/fallback when pending exists) under strict stability workload; no gain.","timestamp":1775302353345,"segment":17,"confidence":null,"iterationTokens":2341,"asi":{"hypothesis":"Flushing pending audio immediately on open could increase on-time completions under hard timeout.","rollback_reason":"Stability metric unchanged at 50%, so added protocol risk without benefit.","next_action_hint":"Avoid early-flush shortcut; pursue resilience features (reconnect/retry semantics) or client pacing controls.","success":"15/30","learning":"Ack/fallback waiting was not the limiting factor for this strict timeout workload."}}
{"run":86,"commit":"14b7f1c","metric":50,"metrics":{},"status":"discard","description":"Retested guarded-delay default 90ms (from 85ms) under strict stability workload; no change in success rate.","timestamp":1775302542529,"segment":17,"confidence":null,"iterationTokens":1806,"asi":{"hypothesis":"More conservative guarded delay could improve strict on-time completion reliability.","rollback_reason":"Stability metric unchanged at baseline (50%).","next_action_hint":"Guard/fallback timing appears non-leveraging for strict stability; shift to retry/recovery semantics or benchmark-level error categorization.","success":"15/30","learning":"Strict timeout failures are not solved by small guarded-delay adjustment."}}
{"type":"config","name":"Live ASR turn latency (paced real speech, transcript-required)","metricName":"asr_response_time","metricUnit":"ms","bestDirection":"lower"}
{"run":87,"commit":"8f19a9f","metric":2086,"metrics":{},"status":"keep","description":"Baseline reset for paced real-speech turn latency on current config before new optimization attempts.","timestamp":1775302604714,"segment":18,"confidence":null,"iterationTokens":127,"asi":{"hypothesis":"Establish fresh baseline after stability-focused branch to compare upcoming latency changes cleanly.","short_turn_runs":"302,434,427,325,1005","full_turn_runs":"3804,3688,3744,3642,3811","metric_definition":"round((short_median + full_median)/2), runs=5, send_pace=60ms"}}
